{
  "id": "burleson",
  "name": "The DRIPBaR Burleson",
  "city": "Burleson",
  "state": "TX",
  "brand_voice_group": "burleson",
  "subdomain": "burleson.thedripbar.com",
  "booking_url": "https://burleson.thedripbar.com/book-appointment/",
  "medical_director": {
    "name": "Dr. Aminidhan D. Thakkar",
    "attribution": "Under the medical direction of Dr. Aminidhan D. Thakkar"
  },
  "brand_voice": {
    "tagline": "The healthiest bar in town",
    "tone": [
      "Fun",
      "Energetic",
      "Confident",
      "Warm",
      "Science-backed but never clinical"
    ],
    "target_audience": "Women 35-54, Burleson/South Fort Worth, proactive wellness seekers. Value education, medical oversight, and real conversations.",
    "content_pillars": [
      "Energy",
      "Immunity",
      "Recovery",
      "Community",
      "Education"
    ],
    "writing_style_notes": "Fun, energetic, confident, warm, science-backed but never clinical. Philosophy: 'This isn't hype. It's hydration.' Burleson doesn't do boring. And neither do we. The DRIPBaR Burleson is the healthiest bar in town. Where wellness meets energy. Where recovery meets community. Where every visit feels like you showed up to something good. Burleson ladies are a vibe. Every visit feels like a party. But behind the fun is serious functional health. You can come in tired and leave energized. Functional health is proactive. Not reactive. We don't wait for problems. We support your body before they start. It's nutrient optimization. It's cellular support. It just happens to be a really good time, too."
  },
  "approved_hashtags": [
    "#TheDRIPBaRBurleson",
    "#FortWorthWellness",
    "#DFWHealth",
    "#BioHack",
    "#BurlesonTX",
    "#IVTherapy",
    "#WellnessBar",
    "#FunctionalHealth",
    "#HydrationTherapy",
    "#BurlesonWellness",
    "#DFWWellness",
    "#TexasWellness"
  ],
  "visual_identity": {
    "colors": {
      "navy": "#3C4C62",
      "lime": "#C1D81A",
      "cyan": "#0E9EC1",
      "white": "#FFFFFF"
    },
    "logos": {
      "primary_ghl_cdn": "https://assets.cdn.filesafe.space/DUPIkcAu6l2rbLLsxhO7/media/64bedd891176ac59660ea0ca.png",
      "satx_email": "https://assets.cdn.filesafe.space/DUPIkcAu6l2rbLLsxhO7/media/655adc4c0226f0ec1406c920.png",
      "non_satx_email": "https://assets.cdn.filesafe.space/A4bIjjCvr66Eom4M81wq/media/690b99fe6fadaa58375c8d36.png",
      "navy_green_svg": "https://drive.google.com/file/d/1Cyi6qFq-miSZFw2Y-wfuAZRUf_u7Zdqg/view",
      "white_green_svg": "https://drive.google.com/file/d/1QYLnqBrbb8lMIWtkvWqIQWFSGyPihNRl/view",
      "white_svg": "https://drive.google.com/file/d/1ac9CRBdxmtyOLrfUrOt7NU4ygxAG7sP2/view",
      "email_logo": "https://assets.cdn.filesafe.space/A4bIjjCvr66Eom4M81wq/media/690b99fe6fadaa58375c8d36.png"
    },
    "photography_style": "4K cinematic candid iPhone photography. Golden hour lighting. White leather IV chairs, white interior walls with vibrant cyan/navy/lime accent wall. Clients in casual clothes or athleisure (never robes). Female nurses in navy blue scrubs with visible blue nitrile gloves. Bright whites, diffused lighting, inviting, lifestyle-editorial feel."
  },
  "social_accounts": {
    "instagram": {
      "handle": "thedripbarburleson",
      "ghl_account_id": ""
    },
    "facebook": {
      "name": "The DRIPBaR Burleson",
      "ghl_account_id": ""
    },
    "gbp": {
      "ghl_account_id": ""
    },
    "threads": {
      "ghl_account_id": ""
    }
  },
  "ghl": {
    "group_name": "",
    "location_id": "0VVRkDLqrPF5oqPjdrAT",
    "user_id": "69bc53160efabb238646637f"
  },
  "content_restrictions": [],
  "email_recipients": [
    "Samantha.Longoria@thedripbar.com",
    "Daley.Lightfoot@thedripbar.com"
  ],
  "sitemap": {
    "subdomain": "burleson",
    "base_url": "https://burleson.thedripbar.com",
    "booking_url": "https://burleson.thedripbar.com/book-appointment/",
    "services_menu": "https://burleson.thedripbar.com/services-menu/",
    "iv_therapy": {
      "High Dose Vitamin C": "https://burleson.thedripbar.com/services-menu/iv-therapy/high-dose-vitamin-c/",
      "Restoration": "https://burleson.thedripbar.com/services-menu/iv-therapy/restoration/",
      "Metabolize": "https://burleson.thedripbar.com/services-menu/iv-therapy/metabolize/",
      "NAD+": "https://burleson.thedripbar.com/services-menu/iv-therapy/nad-plus/",
      "Powerpack": "https://burleson.thedripbar.com/services-menu/iv-therapy/powerpack/",
      "Nicotinamide Riboside (NR)": "https://burleson.thedripbar.com/services-menu/iv-therapy/nicotinamide-riboside-nr/",
      "Time Machine": "https://burleson.thedripbar.com/services-menu/iv-therapy/time-machine/",
      "Allstar": "https://burleson.thedripbar.com/services-menu/iv-therapy/allstar/",
      "Alpha Lipoic Acid (ALA)": "https://burleson.thedripbar.com/services-menu/iv-therapy/alpha-lipoic-acid-ala/",
      "Heavy Metal Detox": "https://burleson.thedripbar.com/services-menu/iv-therapy/heavy-metal-detox/",
      "The Debut": "https://burleson.thedripbar.com/services-menu/iv-therapy/the-debut/",
      "Flu Fighter": "https://burleson.thedripbar.com/services-menu/iv-therapy/flu-fighter/",
      "Maternal Wellness": "https://burleson.thedripbar.com/services-menu/iv-therapy/maternal-wellness/",
      "Shield": "https://burleson.thedripbar.com/services-menu/iv-therapy/shield/",
      "Allergy": "https://burleson.thedripbar.com/services-menu/iv-therapy/allergy/",
      "Firm": "https://burleson.thedripbar.com/services-menu/iv-therapy/firm/",
      "Pre-Op": "https://burleson.thedripbar.com/services-menu/iv-therapy/pre-op/",
      "Pre/Post-Op": "https://burleson.thedripbar.com/services-menu/iv-therapy/pre-post-op/",
      "Post-Op": "https://burleson.thedripbar.com/services-menu/iv-therapy/post-op/",
      "Vitality": "https://burleson.thedripbar.com/services-menu/iv-therapy/vitality/",
      "Glutathione": "https://burleson.thedripbar.com/services-menu/iv-therapy/glutathione/",
      "Post Viral": "https://burleson.thedripbar.com/services-menu/iv-therapy/post-viral/",
      "Jetsetter": "https://burleson.thedripbar.com/services-menu/iv-therapy/jetsetter-drip/",
      "Soother": "https://burleson.thedripbar.com/services-menu/iv-therapy/soother/"
    },
    "wellness_services": {
      "Semaglutide & Tirzepatide": "https://burleson.thedripbar.com/services-menu/wellness-services/semaglutide-and-tirzepatide/",
      "Sermorelin Peptide Therapy": "https://burleson.thedripbar.com/services-menu/wellness-services/sermorelin-peptide-therapy/",
      "Red Light Therapy": "https://burleson.thedripbar.com/services-menu/wellness-services/red-light-therapy/",
      "Infrared Sauna": "https://burleson.thedripbar.com/services-menu/wellness-services/infrared-sauna/",
      "Halotherapy": "https://burleson.thedripbar.com/services-menu/wellness-services/halotherapy/"
    },
    "add_ons": {
      "Drip Add-Ons": "https://burleson.thedripbar.com/services-menu/add-ons-and-injections/drip-add-ons/"
    },
    "im_quick_shots": {
      "IM Detoxed": "https://burleson.thedripbar.com/services-menu/add-ons-and-injections/im-quick-shots/im-detoxed/",
      "IM Glowing": "https://burleson.thedripbar.com/services-menu/add-ons-and-injections/im-quick-shots/im-glowing/",
      "IM Lean": "https://burleson.thedripbar.com/services-menu/add-ons-and-injections/im-quick-shots/im-lean/",
      "IM Strong": "https://burleson.thedripbar.com/services-menu/add-ons-and-injections/im-quick-shots/im-strong/",
      "IM Supercharged": "https://burleson.thedripbar.com/services-menu/add-ons-and-injections/im-quick-shots/im-supercharged/",
      "IM Vitalized": "https://burleson.thedripbar.com/services-menu/add-ons-and-injections/im-quick-shots/im-vitalized/"
    },
    "im_single_shots": {
      "MIC Products": "https://burleson.thedripbar.com/services-menu/add-ons-and-injections/im-single-shots/mic-products/",
      "Tri-Immune": "https://burleson.thedripbar.com/services-menu/add-ons-and-injections/im-single-shots/tri-immune/"
    },
    "wellness_needs": {
      "Wellness Needs": "https://burleson.thedripbar.com/wellness-needs/",
      "Anti-Aging & Beauty": "https://burleson.thedripbar.com/wellness-needs/anti-aging-and-beauty/",
      "Skin Health": "https://burleson.thedripbar.com/wellness-needs/anti-aging-and-beauty/skin-health/",
      "Acne": "https://burleson.thedripbar.com/wellness-needs/anti-aging-and-beauty/acne/",
      "Hair Loss": "https://burleson.thedripbar.com/wellness-needs/anti-aging-and-beauty/hair-loss/",
      "Wrinkle Prevention": "https://burleson.thedripbar.com/wellness-needs/anti-aging-and-beauty/wrinkle-prevention/",
      "Sun Damage": "https://burleson.thedripbar.com/wellness-needs/anti-aging-and-beauty/sun-damage-and-photodamage/",
      "Hyperpigmentation": "https://burleson.thedripbar.com/wellness-needs/anti-aging-and-beauty/hyperpigmentation/",
      "Healthy Aging": "https://burleson.thedripbar.com/wellness-needs/anti-aging-and-beauty/healthy-aging/",
      "Cellular Repair": "https://burleson.thedripbar.com/wellness-needs/anti-aging-and-beauty/cellular-repair/",
      "Nail and Cuticle Health": "https://burleson.thedripbar.com/wellness-needs/anti-aging-and-beauty/nail-and-cuticle-health/",
      "Diseases & Illnesses": "https://burleson.thedripbar.com/wellness-needs/diseases-and-illnesses/",
      "Diabetes": "https://burleson.thedripbar.com/wellness-needs/diseases-and-illnesses/diabetes/",
      "Cardiovascular Disease": "https://burleson.thedripbar.com/wellness-needs/diseases-and-illnesses/cardiovascular-disease/",
      "Autoimmune": "https://burleson.thedripbar.com/wellness-needs/diseases-and-illnesses/autoimmune/",
      "Irritable Bowel Syndrome": "https://burleson.thedripbar.com/wellness-needs/diseases-and-illnesses/irritable-bowel-syndrome/",
      "Eczema and Psoriasis": "https://burleson.thedripbar.com/wellness-needs/diseases-and-illnesses/eczema-and-psoriasis/",